{
  "operationId": "op_aaaaaaaaaaaaaaaaaaaaaaaaaaaaaaaaaaaaaaaaaaaaaaaaaaaaaaaaaaaaaaaa",
  "operationType": "raster.setPixel",
  "schemaVersion": 1,
  "commandId": "command-1",
  "projectId": "project-1",
  "assetId": "asset-1",
  "actorId": "actor-1",
  "clientId": "client-1",
  "clientSequence": 1,
  "structureEpoch": 1,
  "payload": {
    "x": 1,
    "y": 0,
    "colorIndex": 1
  }
}
